id,title,score,num_comments,author,created_utc,url,over_18,edited,spoiler,stickied
1gwns3g,5 months into my first job as a data engineer ,69,21,kissoflifeeee,2024-11-21 19:21:26,https://www.reddit.com/r/dataengineering/comments/1gwns3g/5_months_into_my_first_job_as_a_data_engineer/,False,False,False,False
1gwuaqe,"Offered promotion day before tech int, smashed int, bombed assessment",35,11,NotEAcop,2024-11-22 00:00:30,https://www.reddit.com/r/dataengineering/comments/1gwuaqe/offered_promotion_day_before_tech_int_smashed_int/,False,False,False,False
1gwo4mj,[DSA] Am I stupid AF or is this normal? ,32,25,wtfzambo,2024-11-21 19:36:03,https://www.reddit.com/r/dataengineering/comments/1gwo4mj/dsa_am_i_stupid_af_or_is_this_normal/,False,False,False,False
1gx1lei,Medallion Architecture- Datavault and Marts,15,13,mrcool444,2024-11-22 06:29:48,https://www.reddit.com/r/dataengineering/comments/1gx1lei/medallion_architecture_datavault_and_marts/,False,False,False,False
1gwr77u,Should We Use FastAPI or Spark to Consume Large API Data with Periodic Status Checks?,11,12,Signal-Friend-1203,2024-11-21 21:43:30,https://www.reddit.com/r/dataengineering/comments/1gwr77u/should_we_use_fastapi_or_spark_to_consume_large/,False,False,False,False
1gx33ka,Apache Arrow: Use-case Example,11,7,Renganathan_M,2024-11-22 08:18:11,https://www.reddit.com/r/dataengineering/comments/1gx33ka/apache_arrow_usecase_example/,False,False,False,False
1gwzu57,Possible Role Pivots to Outside Data Engineering and the Data Analytics/ML Space as a Whole,10,2,Deydex,2024-11-22 04:43:04,https://www.reddit.com/r/dataengineering/comments/1gwzu57/possible_role_pivots_to_outside_data_engineering/,False,False,False,False
1gwozn9,Is migration a good project to start with as a junior?,9,4,aleksyniemir1,2024-11-21 20:11:07,https://www.reddit.com/r/dataengineering/comments/1gwozn9/is_migration_a_good_project_to_start_with_as_a/,False,False,False,False
1gx9xun,Company being acquired,10,46,larutinacoffee,2024-11-22 15:08:39,https://www.reddit.com/r/dataengineering/comments/1gx9xun/company_being_acquired/,False,False,False,False
1gx87c6,How to Scrape Reviews from Google Maps,7,0,9millionrainydays_91,2024-11-22 13:46:22,https://blog.stackademic.com/how-to-scrape-reviews-from-google-maps-aaeeb9402279,False,False,False,False
1gxbwvu,What are the advantages of Snowflake over other Data Warehouses ?,11,22,Nahid59,2024-11-22 16:32:49,https://www.reddit.com/r/dataengineering/comments/1gxbwvu/what_are_the_advantages_of_snowflake_over_other/,False,False,False,False
1gx8ywt,Advice Needed for My Data Engineering Project,5,4,DragonfruitMelodic88,2024-11-22 14:23:48,https://www.reddit.com/r/dataengineering/comments/1gx8ywt/advice_needed_for_my_data_engineering_project/,False,False,False,False
1gx38qt,Stackable.tech Production,4,0,Big_Apple_9095,2024-11-22 08:29:28,https://www.reddit.com/r/dataengineering/comments/1gx38qt/stackabletech_production/,False,False,False,False
1gwmtmx,Looking for UI Tools to Upload and Manage Data Pipelines – What Do You Use?,5,2,Dr_Jeans_,2024-11-21 18:44:17,https://www.reddit.com/r/dataengineering/comments/1gwmtmx/looking_for_ui_tools_to_upload_and_manage_data/,False,False,False,False
1gwkzc0,Opportunity to migrate Oracle BIEE on-premises data to a Microsoft cloud-based data storage solution.,5,2,PersonalityRare1278,2024-11-21 17:32:57,https://www.reddit.com/r/dataengineering/comments/1gwkzc0/opportunity_to_migrate_oracle_biee_onpremises/,False,False,False,False
1gxaikk,Help with open-source stack tools for product analytics use case,3,5,dataismysuperpower,2024-11-22 15:33:41,https://www.reddit.com/r/dataengineering/comments/1gxaikk/help_with_opensource_stack_tools_for_product/,False,False,False,False
1gx78sw,Data Engineers: What’s Missing From Your API Debugging Toolbox?,2,6,slypedast,2024-11-22 12:59:07,https://www.reddit.com/r/dataengineering/comments/1gx78sw/data_engineers_whats_missing_from_your_api/,False,False,False,False
1gx6x7b,Consulting firm focused on small to medium businesses ,3,6,jfftilton,2024-11-22 12:41:40,https://www.reddit.com/r/dataengineering/comments/1gx6x7b/consulting_firm_focused_on_small_to_medium/,False,False,False,False
1gwl2vl,Can you be both DE and DA abroad?,3,4,CauliflowerJolly4599,2024-11-21 17:36:49,https://www.reddit.com/r/dataengineering/comments/1gwl2vl/can_you_be_both_de_and_da_abroad/,False,False,False,False
1gxa2oo,Redshift + DBT Slow incremental load,2,0,Certain_Mix4668,2024-11-22 15:14:22,https://www.reddit.com/r/dataengineering/comments/1gxa2oo/redshift_dbt_slow_incremental_load/,False,False,False,False
1gx6xif,"I have no experience in Mitzu, has anybody tried it?",0,1,Ambrus2000,2024-11-22 12:42:10,https://www.reddit.com/r/dataengineering/comments/1gx6xif/i_have_no_experience_in_mitzu_has_anybody_tried_it/,False,False,False,False
1gx4b21,Anyone working with Roku data clean rooms ,2,0,battle_born_8,2024-11-22 09:50:52,https://www.reddit.com/r/dataengineering/comments/1gx4b21/anyone_working_with_roku_data_clean_rooms/,False,False,False,False
1gx3smt,Should I take Data Science undergrad?,2,6,OneandOnlySasuke,2024-11-22 09:11:59,https://www.reddit.com/r/dataengineering/comments/1gx3smt/should_i_take_data_science_undergrad/,False,False,False,False
1gwys0d,Bytebase 3.1.0 released -- Database DevSecOps for MySQL/PG/MSSQL/Oracle/Snowflake/Clickhouse ...,2,0,Adela_freedom,2024-11-22 03:44:17,https://www.bytebase.com/changelog/bytebase-3-1-0/,False,False,False,False
1gwvv34,In need of API or Extraction idea,2,2,Individual-Ad-8398,2024-11-22 01:14:37,https://www.reddit.com/r/dataengineering/comments/1gwvv34/in_need_of_api_or_extraction_idea/,False,False,False,False
1gxapf3,Seeking Advice on Cloud Learning Path for Data Engineering,1,2,Cyber-Dude1,2024-11-22 15:42:10,https://www.reddit.com/r/dataengineering/comments/1gxapf3/seeking_advice_on_cloud_learning_path_for_data/,False,False,False,False
1gx2uxl,Looking to connect ,1,1,Baselnabil22,2024-11-22 08:00:26,https://www.reddit.com/r/dataengineering/comments/1gx2uxl/looking_to_connect/,False,False,False,False
1gwqeuo,Open and edit 170 GB .bak file,1,2,reddit_goes_bankrupt,2024-11-21 21:09:59,https://www.reddit.com/r/dataengineering/comments/1gwqeuo/open_and_edit_170_gb_bak_file/,False,False,False,False
1gwq13w,Recommendations for taking a local script to cloud and or utilizing on-demand GPU and LLM APIs,1,0,makelefani,2024-11-21 20:54:15,https://www.reddit.com/r/dataengineering/comments/1gwq13w/recommendations_for_taking_a_local_script_to/,False,False,False,False
1gwmha1,"Recommendations for best Data Modeling Cheat Sheets, Practice Questions and Study Guides??? (Normalization, OLAP, OLTP, Star/Snowflake, Data vault, Kimball, Inman, 1NF,2NF,3NF,BCNF)????",1,0,juan_berger,2024-11-21 18:30:43,https://www.reddit.com/r/dataengineering/comments/1gwmha1/recommendations_for_best_data_modeling_cheat/,False,False,False,False
